{
  "global": {
    "main_traveller": "John Doe",
    "travel_summary": "Belfast visit",
    "from_date": "01/05/2016",
    "to_date": "13/05/2016",
    "activity": "Company Activities",
    "reason": "",
    "luggage": true
  },
  "flights": [
    {
      "departure_airport": "GDN - Gdansk",
      "destination_airport": "DUB - Dublin",
      "departure_date": "01/05/2016",
      "departure_time": "11.00",
      "requisition_notes": "Ryanair\nGdansk (GDN) -> Dublin (DUB)\n10:45 - 12:40\n\nLuggage 20kg\n"
    },
    {
      "departure_airport": "DUB - Dublin",
      "destination_airport": "GDN - Gdansk",
      "departure_date": "13/05/2016",
      "departure_time": "06.00",
      "requisition_notes": "Ryanair\nDublin (DUB) -> Gdansk (GDN)\n06:15 - 09:55\n\nLuggage 20kg\n"
    }
  ],
  "hotels": [
    {
      "check_in": "01/05/2016",
      "check_out": "12/05/2016",
      "preference": "Dukes at Queens in Belfast",
      "requisition_notes": ""
    },
    {
      "check_in": "12/05/2016",
      "check_out": "13/05/2016",
      "preference": "Maldron Hotel Dublin Airport room only",
      "requisition_notes": ""
    }
  ],
  "trains": [
    {
      "departure_station": "Dublin Airport",
      "departure_date": "01/05/2016",
      "departure_time": "14.00",
      "destination_station": "Belfast (Europa Bus Centre)",
      "requisition_notes": "Aircoach @ 13:55"
    },
    {
      "departure_station": "Belfast (Europa Bus Centre)",
      "departure_date": "12/05/2016",
      "departure_time": "17.30",
      "destination_station": "Dublin Airport",
      "requisition_notes": "Aircoach @ 17:30"
    }
  ],
  "taxis": [
    {
      "departure_address": "ul. Dluga 1, Gdansk",
      "departure_date": "01/05/2016",
      "departure_time": "09:00",
      "destination_address": "Gdansk Airport",
      "requisition_notes": "Phone: +48 123 345 678"
    },
    {
      "departure_address": "Gdansk Airport",
      "departure_date": "13/05/2016",
      "departure_time": "09:00",
      "destination_address": "ul. Dluga 1, Gdansk",
      "requisition_notes": "Phone: +48 123 345 678"
    }
  ]
}
